{
  "schema_version": "1.0.0",
  "slice_id": "world-slice-leonardo-romagna-1502-v1",
  "review_id": "gate-c-review-validator-integrity-final-bd2e103c",
  "reviewer_id": "codex-validator-integrity",
  "reviewer_instance_id": "gate-c-validator-integrity-final-20260809T103212Z",
  "track": "validator-integrity",
  "independence_method": "separate_agent_task_read_only",
  "frozen_commit": "bd2e103cdeec615cb19f0a4293c708fe37a4ae52",
  "frozen_tree": "757fc3d0701e825e865ceeec401d233484f066b7",
  "reviewed_content_digest": "1323ca8f0e85e0d1287cdf8d78db8fcfd907551d7a7dbb37646725cbba72ddca",
  "started_at": "2026-08-09T10:32:12Z",
  "completed_at": "2026-08-09T10:35:17Z",
  "duration_minutes": 4,
  "decision": "READY",
  "unresolved_critical": 0,
  "unresolved_material": 0,
  "cost_activity_ref": "cost-final-validator-integrity-review",
  "findings": [],
  "commands": [
    "git identity/status -> clean exact commit bd2e103c and tree 757fc3d; Git time 2026-08-09T15:31:19+05:00",
    "git diff from fifth READY revision -> only tests/test_project_state.py and append-only curation_cost.json",
    "reviewed-content digest and Git time normalization -> exact digest; commit_time_utc=2026-08-09T10:31:19Z",
    "migration preflight -> PASS; 12 migration versions; read-only",
    "release_check.py -> PASS all release/governance lanes",
    "Explorer State validator and tests -> PASS; 12 passed",
    "project_state validator and tests -> PASS in-progress state; 17 passed",
    "Leonardo World Slice validator and tests -> PASS; 30 passed",
    "governance/lifecycle/runtime boundary tests -> 28 passed",
    "completed-FREEZE and exact-Git in-memory harness -> 27/27 intended results; valid transitions accepted; corruptions rejected; lifecycle tests pass on completed base",
    "selection/source/coverage/cost/Claims JSON Schema validation -> 5/5 PASS",
    "final git status and diff check -> clean; no reviewer mutations"
  ],
  "conclusion": "READY: exact revision bd2e103c passes validator integrity with zero critical or material findings. Completed FREEZE validation, state-independent tests, Git identity/digest/chronology, artifacts, append-only costs and state transitions all behave correctly."
}
